[
  {
    "_id": "DESC:0139 M,N|in_service.date|desc-2024>desc-2025",
    "field": "in_service.date",
    "from_page": 3,
    "from_source": "desc-2024",
    "new": "2026-05-31",
    "old": "2024-12-31",
    "project_key": "DESC:0139 M,N",
    "to_page": 2,
    "to_source": "desc-2025"
  },
  {
    "_id": "DESC:0139 M,N|cost_usd|desc-2024>desc-2025",
    "field": "cost_usd",
    "from_page": 3,
    "from_source": "desc-2024",
    "new": 11630257,
    "old": 11116933,
    "project_key": "DESC:0139 M,N",
    "to_page": 2,
    "to_source": "desc-2025"
  },
  {
    "_id": "DESC:0147 B, J|in_service.date|desc-2024>desc-2025",
    "field": "in_service.date",
    "from_page": 38,
    "from_source": "desc-2024",
    "new": "2028-12-31",
    "old": "2027-12-31",
    "project_key": "DESC:0147 B, J",
    "to_page": 32,
    "to_source": "desc-2025"
  },
  {
    "_id": "DESC:0147 B, J|cost_usd|desc-2024>desc-2025",
    "field": "cost_usd",
    "from_page": 38,
    "from_source": "desc-2024",
    "new": 17955000,
    "old": 18000000,
    "project_key": "DESC:0147 B, J",
    "to_page": 32,
    "to_source": "desc-2025"
  },
  {
    "_id": "DESC:0147 C, K|in_service.date|desc-2024>desc-2025",
    "field": "in_service.date",
    "from_page": 37,
    "from_source": "desc-2024",
    "new": "2028-12-31",
    "old": "2027-12-31",
    "project_key": "DESC:0147 C, K",
    "to_page": 31,
    "to_source": "desc-2025"
  },
  {
    "_id": "DESC:0147 C, K|cost_usd|desc-2024>desc-2025",
    "field": "cost_usd",
    "from_page": 37,
    "from_source": "desc-2024",
    "new": 21800000,
    "old": 21850000,
    "project_key": "DESC:0147 C, K",
    "to_page": 31,
    "to_source": "desc-2025"
  },
  {
    "_id": "DESC:06076A|in_service.date|desc-2024>desc-2025",
    "field": "in_service.date",
    "from_page": 20,
    "from_source": "desc-2024",
    "new": "2028-06-01",
    "old": "2026-06-01",
    "project_key": "DESC:06076A",
    "to_page": 15,
    "to_source": "desc-2025"
  },
  {
    "_id": "DESC:06076A|cost_usd|desc-2024>desc-2025",
    "field": "cost_usd",
    "from_page": 20,
    "from_source": "desc-2024",
    "new": 38041268,
    "old": 40000000,
    "project_key": "DESC:06076A",
    "to_page": 15,
    "to_source": "desc-2025"
  },
  {
    "_id": "DESC:06367 A - C, H|in_service.date|desc-2024>desc-2025",
    "field": "in_service.date",
    "from_page": 22,
    "from_source": "desc-2024",
    "new": "2026-05-31",
    "old": "2025-12-31",
    "project_key": "DESC:06367 A - C, H",
    "to_page": 17,
    "to_source": "desc-2025"
  },
  {
    "_id": "DESC:06367 A - C, H|cost_usd|desc-2024>desc-2025",
    "field": "cost_usd",
    "from_page": 22,
    "from_source": "desc-2024",
    "new": 54446256,
    "old": 34877427,
    "project_key": "DESC:06367 A - C, H",
    "to_page": 17,
    "to_source": "desc-2025"
  },
  {
    "_id": "DESC:06367 A - C, H|name|desc-2024>desc-2025",
    "field": "name",
    "from_page": 22,
    "from_source": "desc-2024",
    "new": "Sherwood Tap: Construct Tap",
    "old": "Riverport Tap: Construct Tap",
    "project_key": "DESC:06367 A - C, H",
    "to_page": 17,
    "to_source": "desc-2025"
  },
  {
    "_id": "DESC:06367 D - G|in_service.date|desc-2024>desc-2025",
    "field": "in_service.date",
    "from_page": 23,
    "from_source": "desc-2024",
    "new": "2026-05-31",
    "old": "2025-12-31",
    "project_key": "DESC:06367 D - G",
    "to_page": 18,
    "to_source": "desc-2025"
  },
  {
    "_id": "DESC:06367 D - G|cost_usd|desc-2024>desc-2025",
    "field": "cost_usd",
    "from_page": 23,
    "from_source": "desc-2024",
    "new": 28578734,
    "old": 23787423,
    "project_key": "DESC:06367 D - G",
    "to_page": 18,
    "to_source": "desc-2025"
  },
  {
    "_id": "DESC:06371 D|in_service.date|desc-2024>desc-2025",
    "field": "in_service.date",
    "from_page": 24,
    "from_source": "desc-2024",
    "new": "2027-12-31",
    "old": "2025-12-31",
    "project_key": "DESC:06371 D",
    "to_page": 19,
    "to_source": "desc-2025"
  },
  {
    "_id": "DESC:06372 A|in_service.date|desc-2024>desc-2025",
    "field": "in_service.date",
    "from_page": 25,
    "from_source": "desc-2024",
    "new": "2025-12-31",
    "old": "2024-06-01",
    "project_key": "DESC:06372 A",
    "to_page": 20,
    "to_source": "desc-2025"
  },
  {
    "_id": "DESC:06372 A|cost_usd|desc-2024>desc-2025",
    "field": "cost_usd",
    "from_page": 25,
    "from_source": "desc-2024",
    "new": 11401163,
    "old": 10850000,
    "project_key": "DESC:06372 A",
    "to_page": 20,
    "to_source": "desc-2025"
  },
  {
    "_id": "DESC:06810 F|cost_usd|desc-2024>desc-2025",
    "field": "cost_usd",
    "from_page": 26,
    "from_source": "desc-2024",
    "new": 38275000,
    "old": 30000000,
    "project_key": "DESC:06810 F",
    "to_page": 21,
    "to_source": "desc-2025"
  },
  {
    "_id": "DESC:06810 G|in_service.date|desc-2024>desc-2025",
    "field": "in_service.date",
    "from_page": 27,
    "from_source": "desc-2024",
    "new": "2025-10-31",
    "old": "2024-12-31",
    "project_key": "DESC:06810 G",
    "to_page": 22,
    "to_source": "desc-2025"
  },
  {
    "_id": "DESC:06810 G|cost_usd|desc-2024>desc-2025",
    "field": "cost_usd",
    "from_page": 27,
    "from_source": "desc-2024",
    "new": 9678370,
    "old": 9655669,
    "project_key": "DESC:06810 G",
    "to_page": 22,
    "to_source": "desc-2025"
  },
  {
    "_id": "DESC:06810 H|in_service.date|desc-2024>desc-2025",
    "field": "in_service.date",
    "from_page": 28,
    "from_source": "desc-2024",
    "new": "2025-12-31",
    "old": "2024-12-31",
    "project_key": "DESC:06810 H",
    "to_page": 23,
    "to_source": "desc-2025"
  },
  {
    "_id": "DESC:1060A, I, L|cost_usd|desc-2024>desc-2025",
    "field": "cost_usd",
    "from_page": 17,
    "from_source": "desc-2024",
    "new": 11182924,
    "old": 9898924,
    "project_key": "DESC:1060A, I, L",
    "to_page": 13,
    "to_source": "desc-2025"
  },
  {
    "_id": "DESC:5392 A-C|in_service.date|desc-2024>desc-2025",
    "field": "in_service.date",
    "from_page": 30,
    "from_source": "desc-2024",
    "new": "2025-12-31",
    "old": "2024-12-31",
    "project_key": "DESC:5392 A-C",
    "to_page": 25,
    "to_source": "desc-2025"
  },
  {
    "_id": "DESC:5392 A-C|cost_usd|desc-2024>desc-2025",
    "field": "cost_usd",
    "from_page": 30,
    "from_source": "desc-2024",
    "new": 5773202,
    "old": 2509602,
    "project_key": "DESC:5392 A-C",
    "to_page": 25,
    "to_source": "desc-2025"
  },
  {
    "_id": "DESC:6341 A-F|in_service.date|desc-2024>desc-2025",
    "field": "in_service.date",
    "from_page": 4,
    "from_source": "desc-2024",
    "new": "2026-12-02",
    "old": "2025-12-01",
    "project_key": "DESC:6341 A-F",
    "to_page": 3,
    "to_source": "desc-2025"
  },
  {
    "_id": "DESC:6341 A-F|cost_usd|desc-2024>desc-2025",
    "field": "cost_usd",
    "from_page": 4,
    "from_source": "desc-2024",
    "new": 31362092,
    "old": 19890850,
    "project_key": "DESC:6341 A-F",
    "to_page": 3,
    "to_source": "desc-2025"
  },
  {
    "_id": "DESC:6359|in_service.date|desc-2024>desc-2025",
    "field": "in_service.date",
    "from_page": 21,
    "from_source": "desc-2024",
    "new": "2027-06-01",
    "old": "2026-06-01",
    "project_key": "DESC:6359",
    "to_page": 16,
    "to_source": "desc-2025"
  },
  {
    "_id": "DESC:6359|cost_usd|desc-2024>desc-2025",
    "field": "cost_usd",
    "from_page": 21,
    "from_source": "desc-2024",
    "new": 45032777,
    "old": 40611419,
    "project_key": "DESC:6359",
    "to_page": 16,
    "to_source": "desc-2025"
  },
  {
    "_id": "DESC:6359|status|desc-2024>desc-2025",
    "field": "status",
    "from_page": 21,
    "from_source": "desc-2024",
    "new": "In Progress",
    "old": "Planned",
    "project_key": "DESC:6359",
    "to_page": 16,
    "to_source": "desc-2025"
  },
  {
    "_id": "DESC:6388 A|in_service.date|desc-2024>desc-2025",
    "field": "in_service.date",
    "from_page": 36,
    "from_source": "desc-2024",
    "new": "2028-12-31",
    "old": "2027-05-01",
    "project_key": "DESC:6388 A",
    "to_page": 30,
    "to_source": "desc-2025"
  },
  {
    "_id": "DESC:6388 A|cost_usd|desc-2024>desc-2025",
    "field": "cost_usd",
    "from_page": 36,
    "from_source": "desc-2024",
    "new": 25500000,
    "old": 19300000,
    "project_key": "DESC:6388 A",
    "to_page": 30,
    "to_source": "desc-2025"
  },
  {
    "_id": "DESC:6388 A|status|desc-2024>desc-2025",
    "field": "status",
    "from_page": 36,
    "from_source": "desc-2024",
    "new": "In Progress",
    "old": "Planned",
    "project_key": "DESC:6388 A",
    "to_page": 30,
    "to_source": "desc-2025"
  },
  {
    "_id": "DESC:6805 G|in_service.date|desc-2024>desc-2025",
    "field": "in_service.date",
    "from_page": 16,
    "from_source": "desc-2024",
    "new": "2025-06-30",
    "old": "2024-12-25",
    "project_key": "DESC:6805 G",
    "to_page": 12,
    "to_source": "desc-2025"
  },
  {
    "_id": "DESC:6805 G|cost_usd|desc-2024>desc-2025",
    "field": "cost_usd",
    "from_page": 16,
    "from_source": "desc-2024",
    "new": 9821256,
    "old": 10833462,
    "project_key": "DESC:6805 G",
    "to_page": 12,
    "to_source": "desc-2025"
  },
  {
    "_id": "DESC:6808 K|in_service.date|desc-2024>desc-2025",
    "field": "in_service.date",
    "from_page": 6,
    "from_source": "desc-2024",
    "new": "2025-04-30",
    "old": "2024-12-31",
    "project_key": "DESC:6808 K",
    "to_page": 4,
    "to_source": "desc-2025"
  },
  {
    "_id": "DESC:6808 K|cost_usd|desc-2024>desc-2025",
    "field": "cost_usd",
    "from_page": 6,
    "from_source": "desc-2024",
    "new": 12000000,
    "old": 8580000,
    "project_key": "DESC:6808 K",
    "to_page": 4,
    "to_source": "desc-2025"
  },
  {
    "_id": "DESC:6808 L|in_service.date|desc-2024>desc-2025",
    "field": "in_service.date",
    "from_page": 7,
    "from_source": "desc-2024",
    "new": "2027-12-31",